{
  "contract": "JoyLab.ResearchGraph",
  "version": "1.0.0",
  "pillar": {
    "id": "ai-power-infrastructure",
    "title": "AI Power Infrastructure",
    "url": "/guides/ai-power-infrastructure",
    "domain": "investing",
    "status": "published"
  },
  "nodes": [
    {"id":"ai-power-infrastructure","type":"pillar","label":"AI Power Infrastructure","articleUrl":"/guides/ai-power-infrastructure","stage":"pillar"},
    {"id":"us-30y","type":"macro","label":"US 30Y Treasury","stage":"macro"},
    {"id":"cost-of-capital","type":"macro","label":"Cost of Capital","stage":"macro"},
    {"id":"ai-data-center-demand","type":"demand","label":"AI Data Center Demand","stage":"value_chain"},
    {"id":"power-demand","type":"demand","label":"Power Demand","stage":"value_chain"},
    {"id":"generation","type":"value_chain","label":"Generation","stage":"value_chain"},
    {"id":"grid","type":"value_chain","label":"Grid","stage":"value_chain"},
    {"id":"transformer","type":"bottleneck","label":"Transformer","stage":"value_chain"},
    {"id":"electrical-equipment","type":"value_chain","label":"Electrical Equipment","stage":"value_chain"},
    {"id":"ls-electric","type":"company","label":"LS ELECTRIC","ticker":"010120","market":"KRX","stage":"company"},
    {"id":"hd-hyundai-electric","type":"company","label":"HD현대일렉트릭","ticker":"267260","market":"KRX","stage":"company"},
    {"id":"eaton","type":"company","label":"Eaton","ticker":"ETN","market":"NYSE","stage":"company"},
    {"id":"ge-vernova","type":"company","label":"GE Vernova","ticker":"GEV","market":"NYSE","stage":"company"},
    {"id":"orders","type":"kpi","label":"Orders","stage":"kpi"},
    {"id":"backlog","type":"kpi","label":"Backlog","stage":"kpi"},
    {"id":"margin","type":"kpi","label":"Operating Margin","stage":"kpi"},
    {"id":"eps","type":"earnings","label":"EPS","stage":"kpi"},
    {"id":"eps-revision","type":"earnings","label":"EPS Revision","stage":"valuation"},
    {"id":"forward-per","type":"valuation","label":"Forward PER","stage":"valuation"},
    {"id":"ev-ebitda","type":"valuation","label":"EV / EBITDA","stage":"valuation"},
    {"id":"article-us-30y-risk","type":"article","label":"미국 30년물 5%대가 10년물보다 더 위험한 이유","articleUrl":"/articles/us-30y-treasury-5-percent-risk-2026","stage":"macro"},
    {"id":"article-ai-power-bottleneck","type":"article","label":"GPU 다음 병목은 발전소다","articleUrl":"/articles/ai-power-next-bottleneck","stage":"value_chain"},
    {"id":"article-grid-transformer","type":"article","label":"AI 전력기기 투자 지도","articleUrl":"/articles/ai-power-grid-transformer-distribution","stage":"value_chain"},
    {"id":"article-hd-electric","type":"article","label":"HD현대일렉트릭 AI 전력 분석","articleUrl":"/articles/hd-hyundai-electric-ai-power","stage":"company"},
    {"id":"article-ls-electric","type":"article","label":"LS ELECTRIC AI 전력 분석","articleUrl":"/articles/ls-electric-ai-power","stage":"company"},
    {"id":"article-korea-ai-power-compare","type":"article","label":"AI 전력 4사 비교","articleUrl":"/articles/korea-ai-power-companies-compare","stage":"valuation"}
  ],
  "edges": [
    {"from":"us-30y","to":"cost-of-capital","type":"affects"},
    {"from":"cost-of-capital","to":"ai-data-center-demand","type":"affects"},
    {"from":"ai-data-center-demand","to":"power-demand","type":"drives"},
    {"from":"power-demand","to":"generation","type":"requires"},
    {"from":"generation","to":"grid","type":"supplies"},
    {"from":"grid","to":"transformer","type":"requires"},
    {"from":"transformer","to":"electrical-equipment","type":"supplies"},
    {"from":"ls-electric","to":"transformer","type":"supplies"},
    {"from":"ls-electric","to":"electrical-equipment","type":"supplies"},
    {"from":"hd-hyundai-electric","to":"transformer","type":"supplies"},
    {"from":"eaton","to":"electrical-equipment","type":"supplies"},
    {"from":"ge-vernova","to":"generation","type":"supplies"},
    {"from":"ge-vernova","to":"grid","type":"supplies"},
    {"from":"orders","to":"backlog","type":"drives"},
    {"from":"backlog","to":"margin","type":"drives_earnings"},
    {"from":"margin","to":"eps","type":"drives_earnings"},
    {"from":"eps","to":"eps-revision","type":"drives_earnings"},
    {"from":"eps-revision","to":"forward-per","type":"valued_by"},
    {"from":"eps-revision","to":"ev-ebitda","type":"valued_by"},
    {"from":"article-us-30y-risk","to":"ai-power-infrastructure","type":"belongs_to"},
    {"from":"article-ai-power-bottleneck","to":"ai-power-infrastructure","type":"belongs_to"},
    {"from":"article-grid-transformer","to":"ai-power-infrastructure","type":"belongs_to"},
    {"from":"article-hd-electric","to":"ai-power-infrastructure","type":"belongs_to"},
    {"from":"article-ls-electric","to":"ai-power-infrastructure","type":"belongs_to"},
    {"from":"article-korea-ai-power-compare","to":"ai-power-infrastructure","type":"belongs_to"},
    {"from":"article-us-30y-risk","to":"us-30y","type":"covered_by"},
    {"from":"article-ai-power-bottleneck","to":"ai-data-center-demand","type":"covered_by"},
    {"from":"article-ai-power-bottleneck","to":"generation","type":"covered_by"},
    {"from":"article-grid-transformer","to":"grid","type":"covered_by"},
    {"from":"article-grid-transformer","to":"transformer","type":"covered_by"},
    {"from":"article-hd-electric","to":"hd-hyundai-electric","type":"covered_by"},
    {"from":"article-hd-electric","to":"transformer","type":"covered_by"},
    {"from":"article-ls-electric","to":"ls-electric","type":"covered_by"},
    {"from":"article-ls-electric","to":"electrical-equipment","type":"covered_by"},
    {"from":"article-korea-ai-power-compare","to":"forward-per","type":"covered_by"},
    {"from":"article-korea-ai-power-compare","to":"margin","type":"covered_by"},
    {"from":"article-us-30y-risk","to":"article-ai-power-bottleneck","type":"next"},
    {"from":"article-ai-power-bottleneck","to":"article-us-30y-risk","type":"previous"},
    {"from":"article-ai-power-bottleneck","to":"article-grid-transformer","type":"next"},
    {"from":"article-grid-transformer","to":"article-ai-power-bottleneck","type":"previous"},
    {"from":"article-grid-transformer","to":"article-hd-electric","type":"next"},
    {"from":"article-hd-electric","to":"article-grid-transformer","type":"previous"},
    {"from":"article-hd-electric","to":"article-ls-electric","type":"next"},
    {"from":"article-ls-electric","to":"article-hd-electric","type":"previous"},
    {"from":"article-ls-electric","to":"article-korea-ai-power-compare","type":"next"},
    {"from":"article-korea-ai-power-compare","to":"article-ls-electric","type":"previous"}
  ],
  "articles": [
    {"id":"article-us-30y-risk","title":"미국 30년물 5%대가 10년물보다 더 위험한 이유","url":"/articles/us-30y-treasury-5-percent-risk-2026","order":1,"pillar":"ai-power-infrastructure","topics":["us-30y","cost-of-capital"],"stage":"macro","previous":null,"next":"article-ai-power-bottleneck","status":"published"},
    {"id":"article-ai-power-bottleneck","title":"GPU 다음 병목은 발전소다｜AI 데이터센터 전력 수요가 바꾸는 투자 지도","url":"/articles/ai-power-next-bottleneck","order":2,"pillar":"ai-power-infrastructure","topics":["ai-data-center-demand","power-demand","generation"],"stage":"value_chain","previous":"article-us-30y-risk","next":"article-grid-transformer","status":"published"},
    {"id":"article-grid-transformer","title":"AI 전력기기 투자 지도｜송전·변압·배전의 병목을 읽는 법","url":"/articles/ai-power-grid-transformer-distribution","order":3,"pillar":"ai-power-infrastructure","topics":["grid","transformer","electrical-equipment","backlog","margin"],"stage":"bottleneck","previous":"article-ai-power-bottleneck","next":"article-hd-electric","status":"published"},
    {"id":"article-hd-electric","title":"HD현대일렉트릭 AI 전력 분석","url":"/articles/hd-hyundai-electric-ai-power","order":4,"pillar":"ai-power-infrastructure","topics":["hd-hyundai-electric","transformer","orders","backlog","margin"],"stage":"company","previous":"article-grid-transformer","next":"article-ls-electric","status":"published"},
    {"id":"article-ls-electric","title":"LS ELECTRIC AI 전력 분석","url":"/articles/ls-electric-ai-power","order":5,"pillar":"ai-power-infrastructure","topics":["ls-electric","electrical-equipment","orders","backlog","margin"],"stage":"company","previous":"article-hd-electric","next":"article-korea-ai-power-compare","status":"published"},
    {"id":"article-korea-ai-power-compare","title":"AI 전력 4사 비교｜두산에너빌리티·효성중공업·HD현대일렉트릭·LS ELECTRIC","url":"/articles/korea-ai-power-companies-compare","order":6,"pillar":"ai-power-infrastructure","topics":["ls-electric","hd-hyundai-electric","backlog","margin","eps-revision","forward-per"],"stage":"valuation","previous":"article-ls-electric","next":null,"status":"published"}
  ]
}